No,GK,GK1,GK2,GK3,GEO,GEO1,GEO2,GEO3,SCI,SCI1,SCI2,SCI3,HIS,HIS1,HIS2,HIS3,MAT,MAT1,MAT2,MAT3,ENG,ENG,ENG2,ENG3
159,Who was the Taoiseach of the Republic of Ireland in 2010?,Joan Burton,Enda Kenny,[Brian Cowen],Name two counties in Leinster that begin with the letter K?,"[Kilkenny, Kildare]",X,X,RNA stands for?,Real Nucleic Acid,[Ribonucleic Acid],Rare Nucleic Acid,Hitler declared himself Führer of Germany in what year?,1940,[1944],1945,What is 0.22 kilometres equal to in centimetres?,"220,000cm","2,200cm","[22,000cm]","""Pygmalion"" is a play by which Irish playwright?",Brian Friel,Brendan Behan,[George Bernard Shaw]
160,Who was the Taoiseach of the Republic of Ireland in 2007?,[Bertie Ahern],Brian Cowen,Enda Kenny,Name two counties in Munster that begin with the letter C?,"[Clare, Cork]",X,X,What disease is caused by a lack of Vitamin D?,Anemia,[Rickets],Night Blindness,What was the name of the peace agreement concluding World War I?,Treaty of Paris,[Treaty of Versailles],Treaty of London,"If 1 mile is equal to 1.6 kilometres, how far is 5 and a half miles in kilometres?",9.6km,8km,[8.8km],'The Importance of Being Ernest'' is a play by which Irish Playwright?,Sean O' Casey,John B. Keane,[Oscar Wilde]
161,"In 2015, who was the Prime Minister of the United Kingdom?",[David Cameron],Teresa May,Jeremy Corbyn,Name two counties in Ulster that begin with the letter A?,"[Armagh, Antrim]",X,X,What is the part of a plant below the ground called?,Petiole,[Root],Stem,"In peace settlements post World War I, to how many personnel was Germany's army limited?","120,000","[100,000]","150,000",What is 8.7 centimetres in millimetres?,870mm,8.7mm,[87mm],"""The Playboy of the Western World"" was written by which Irish playwright?",Mark O' Rowe,Sebastian Barry,[J.M Synge]
162,In which sport does Katie Taylor compete?,[Boxing],Cycling,Athletics,Producing crops and animals to sell for profit is what type of farming?,Trade Farming,Product Farming,[Commercial Farming],What is the scapula bone more commonly known as?,Collar Bone,[Shoulder Blade],Hip,In 1939 the Nazi-Soviet pact agreed to the partition of which country?,Ukraine,[Poland],Belarus,What is 0.65 kilograms equal to in grams?,6.5g,65g,[650g],Professor Higgins is the main character in which George Bernard Shaw play?,Arms and the Man,Man and Superman,[Pygmalion]
163,In which sport does Serena Williams compete?,[Tennis],Golf,Rowing,Crops grown for profit are known as what types of crops? ,Paying Plants,Coin Crops,[Cash Crops],What is the mark left on tissue after a wound has healed called?,Stiches,[Scar],Fracture,The USA & the USSR officially declared the end to the Cold War in which year?,1990,[1989],1988,5600 grams is equal to what in kilograms?,560kg,5.06kg,[5.6kg],"In ""Pygmalion"", professor Higgins is helping Eliza Doolittle with what aspect of her life?",Her reading,Her hearing,[Her speech]
164,"Which car company won ""24 Hours of Le Mans"" in 1966?",[Ford],Ferrari,Porsche,The growing of only one crop is known as?,Single-planting,Monogrowing,[Monoculture],In what part of the body is the tibia bone found?,Arm,[Leg],Foot,Which Soviet leader introduced Glasnost and Perestroika in 1986?,Chernenko,[Gorbachev],Andropov,"If 1 kilogram is equal to 2.2 pounds, what is 3 kilograms equal to in pounds?",6.8 Pounds,6 Pounds,[6.6 Pounds],Christy Mahon is the main character in which J.M Synge play?,In the Shadow of Glen,Riders of the Sea,[Playboy of the Western World]
165,"""Thing 1"" and ""Thing 2"" are characters in which Dr. Suess book?",[The Cat in the Hat],The Grinch,The Lorax,Land used for the cultivation of crops is known as?,Fruitful land,Pastoral Land,[Arable Land],In what part of the body is the radius bone found?,Leg,[Arm],Back,The Franco Prussian war took place between what years?,1875-1877,[1870-1871],1871-1872,How many pounds are in 1 stone?,12,16,[14],"In which County in Ireland is J.M Synge's ""Playboy of the Western World"" set?",Dublin,Galway,[Mayo]
166,Who painted the Mona Lisa?,[Leonardo da Vinci], Vincent Van Gogh ,Rembrandt,What is land used for the raising of livestock known as? ,Grasslands,Arable Land,[Pastoral Land],What is the outer layer of skin called?,Dermis,[Epidermis],Hypodermis,"In 1945, the Japanese cities of Hiroshima and Nagasaki were bombed by what country? ",Britain,[USA],Germany ,In what units is volume measured?,PSI,Grams,[Cubic meters],"In Thomas Hardy's ""The Mayor of Casterbridge"" , Michael Henchard's past returns to haunt him, what did he do?",Had an affair,Robbed his wife,[Sold his wife]
167,"What is the name of the Lion in The Lion, The Witch and the Wardrobe",[Aslan],Maugrim,Mufasa,"Commercial, intensive production of milk is known as?",Milk Farming,Buttery,[Dairying],"Of what are loam, clay and sandy the three main types?",Beaches,[Soil],Stones,What was the name of the pact in 1955 between the communist countries of Europe?,Moscow Pact,[Warsaw Pact],Berlin Agreement,How many litres are there in a cubic metre?,10 litres,100 litres,[1000 litres],"""Tess of the d'Urbervilles"" is a novel by which author?",James Patterson,John Cleese,[Thomas Hardy]
168,In March 2020 which country was the 1st epicentre of COVID 19 in Europe? ,[Italy],Portugal,Sweden,What is the cyclical planting of different crops in a field called? ,Crop Cycle,Crop Revolving,[Crop Rotation],Tarsals are bones found in which part of the  body?,Fingers,[Foot],Ear,In 1958 Charles De Gaulle was elected president of which European Country?,Italy,[France],Belgium,What is the volume of a cube with a side length of 2cm,16 cubic centimetres,4 cubic centimetres,[8 cubic centimetres ],"""Nineteen Eighty Four"" is a futuristic novel by which author?",J.R.R Tolkein,Jane Austen,[George Orwell]
169,What was the name of Harry Potter’s pet owl?,[Hedwig],Dobby,Hagrid,"What is fermented grass, fed to animals in winter, known as?",Fodder,Bales,[Silage],What is the white fibrous tissue connecting muscle to bones called?,Ligaments,[Tendon],Adipose Tissue,In 1959 who was elected president of Ireland?,Sean T. O'Kelly,[Éamon De Valera],Douglas Hyde,What is the bottom number of a fraction usually called?,Divisor,Numerator,[Denominator],Winston is being watched by big brother in which George Orwell novel?,Burmese Days,Animal Farm,[Nineteen Eighty Four]
170,How many NBA Championships did Michael Jordan win with the Chicago Bulls?,[6],5,4,The artificial watering of land is known as?,Spraying,Hydration,[Irrigation],The hormone testosterone is produced in what part of the body?,Prostate Gland,[Testes],Scrotum,In 1961 the soviets built a wall dividing which German city?,Munich,[Berlin],Frankfurt,What is 32/48 in its simplest form?,08-Dec,04-Jun,[2/3],Dorian Gray is a character created by which Irish playwright?,Oliver Goldsmith,Maeve Binchy ,[Oscar Wilde]
171,Which artist painted a number of pictures of sunflowers?,[Vincent Van Gogh],Andy Warhol,Michelangelo,The money paid to farmers to raise specific crops or animals is known as what?,Growth Funding,Grant,[Subsidy],What is the name of the gland that is located near the base of the neck?,Nymph Gland,[Thyroid Gland],Prostate Gland,In what year was the Versailles Treaty signed?,1920,[1919],1918,What is 54/90 in its simplest form?,Dec-20,06-Oct,[3/5],What is a figure of speech in which two things are compared using 'like' or 'as'?,Contrast,Metaphor,[Simile]
172,Where were the Olympics held in 2004?,[Athens],Beijing,Sydney,What is the seasonal heavy rains in rice-growing areas is know as?,Flooding,Washout,[Monsoon],What is the lymphoid tissue near the base of the tongue called?,Adenoids,[Tonsils],Adams Apple,"In 1919, what country was the Treaty of Versailles signed in?",Italy,[France],Spain,What is 48/60 in its simplest form?,[4/5],X,X,Shakespeare wrote the majority of his poems in which form?,Narrative ,Free verse,[Sonnet]
173,How many wives did Henry VIII have?,8,5,[6],What is growing two or more crops on a farm in a single year known as? ,Fast Track Planting,High Production Planting,[Multiple Cropping],What gas is dry ice made from?,Sulfur Dioxide,[Carbon Dioxide],Nitrogen,In what country was German dictator Adolf Hitler born?,Germany,[Austria],Hungary,What is 64/96 in its simplest form?,[2/3],X,X,"Wordsworth, Coleridge, Byron and Keats are described as what type of poets?",Tragic,Comedic ,[Romantic]
174,In 2019 which channel had the most subscibers on YouTube?,[T-Series],PewDiePie,Dude Perfect,What is the number of babies born per 1000 people per year known as?,Birth Figure,Births per Annum,[Birth Rate],Enamel is the outer layer on which body part?,Nail,[Tooth],Eyes,Of which country was Arch Duke Franz Ferdinand heir to the throne?,Romania,[Austria-Hungary],Slovenia,What is 24/72 in its simplest form?,[1/3],X,X,"""Oliver Twist"" and ""A Christmas Carol"" were written by which Victorian Novelist?",Geoffrey Chaucer,Joseph Conrad,[Charles Dickens]
175,"Which member of ""The Sidemen"" has released songs with Rick Ross & Lil Baby?",[KSI],W2S,Behzinga,What is the number of people dying per 1000 people per year known as?,Death Figure,[Death Rate],Deaths per Annum,What is a poison produced by living organisms called?,Venom,[Toxin],Enzyme,In which city was Franz Ferdinand assassinated?,Bucharest,[Sarajevo],Budapest,The top number of a fraction is known as what?,[Numerator],Denominator,Multiple,A poem that is unrhymed in iambic pentameter is known as what type of poem?,Sestina,Free Verse,[Blank Verse]
176,In March 2020 which country was the 1st epicentre of COVID 19 in America? ,[New York],Atlanta,Los Angeles,The average period that a person can expect to live is known as what?,Life Span,[Life Expectancy],Life Cycle,What is the trachea more commonly known as?,Oesophagus,[Windpipe],Vocal Chords,Which countries were part of the Central Powers in World War I?,[Austria-Hungary],Japan,Russia,What do you call a fraction that has a numerator equal to or greater than the denominator?,[Improper fraction],Irregular fraction,Irrational fraction,A pair of rhyming lines in a poem are known as what?,A duet,A pair,[A Couplet]
177,"In 2019 which sports brand endorsed Lebron James, Ronaldo and Rory McIlroy?",[Nike],Adidas,Puma,"What is the make up of a population, in terms of age and gender, known as?",Society Structure,[Population Structure],Population Statistics,"When you burn lithium, what colour flame does it produce?",Blue,[Red],Green ,Which countries were known as the Triple Entente in World War I?,"[Britain, Russia & France]","Britain, USA & Russia","Britain, USA & France",Solve 1/2  +  2/8,[6/8 or 3/4],X,X,By what name is a poem of moderate length written in the classical form known as?,Haiku,Sonnet,[Ode]
178,Air Force One is a plane used by the holder of what position?,[The President of the USA],The British Prime Minster,The French President,What is a diagram to show population structure known as? ,Population Chart,[Population Pyramid],Population Graph,What is the navel cord which connects the embryo to the placenta called?,Fallopian Cord,[Umbilical Cord],Antenatal Cord,"Tanks, poison, airplanes and depth chargers were introduced as weapons in which war?",[World War I],World War II,Vietnam War,Is 18/72  = 1/4?,[Yes ],No,X,The repetition of a sound at the end of lines in a poem is called what?,Cadence,Beat,[Rhyme]
179,"Which iconic Irish artist started ""Live Aid""?",[Bob Geldof],Bono,Johnny Logan,The way people are spread out over an area is known as? ,Population Dispersal,[Population Distribution],Population Placement,What is an organism consisting of just one cell called?,Single cell,[Unicellular],Primary cellular,In June of which year were the D-Day landings?,[1944],1945,1943,Is 1%  = 10/1000,[Yes],No,X,What is the name for a group of lines in a poem?,Verselet,Verse,[Stanza]
180,Name the second largest planet in the Solar System.,Jupiter,[Saturn],Mars,What are situations which encourage people to move from an area known as? ,Drive Factors,[Push Factors],Strike Factors,If a person is a universal donor what blood group would they have?,Group A,[Group O ],Group B +,Which of these beaches was a landing spot for the Allies during World War II?,[Juno Beach],Pluto Beach,Silver Beach,"In arithmetic, what does PAYE stand for?",[Pay As You Earn],X,X,The feeling of a recurring beat or accent in a poem is called what?,Pattern,Tempo,[Rhythm]
181,Sheriff Woody and Buzz Lightyear are major characters in which series of films?,Frozen,[Toy Story],Peter Pan,What are situations which encourage people to move into an area known as? ,Attraction Factors,[Pull Factors],Movement Factors,If a person is a universal recipient what blood group would they have?,Group O,[Group AB],Group A,What was the official operation name of the D-Day landings?,[Operation Overlord],Operation Sealion,Operation Neptune,What does PRSI stand for?,[Pay Related Social Insurance],X,X,A four line stanza or four line poem is called what?,Acrostic Poem,Ode,[Quatrain]
182,Which television series is set in the town of Pontypandy?,Balamory,[Fireman Sam],Thomas the Tank Engine,What is it called when the birth rate is much higher than the death rate in a population?,Population Overload,[Population Explosion],Baby Boom,What is the fluid formed in the kidney called?,Bile ,[Urine],Insulin,O'Connell founded the repeal association to overturn which Act?,[Act of Union],Statute of Westminster,Government of Ireland Act,"What is the name of the amount that remains, after tax  credits are deducted from your gross tax?",[Tax  payable],Net tax ,Tax  total,Are the words 'zoom' and 'crash' examples of onomatopoeia?,[Yes],No,X
183,"What is the name of the hero in ""The Lion King""?",Mufasa,[Simba],Scar,What is a person forced to move due to persecution or war known as?,Migrant,[Refugee],Asylum Seeker,The foetus develops in which part of the female body?,Fallopian Tube,[Uterus],Placenta,In 1928 O'Connell was elected to Westminster as an MP for which county in Ireland?,[Co. Cork],Co. Dublin,Co. Kerry,"What are deductions that are taken from gross pay, at the request of the employee called?",[Voluntary contributions / Non-statutory deductions],X,X,A three line stanza or three line poem is called what?,[Triplet],Limerick ,Ode
184,Wolverine is the leader of which band of superheroes?,The Avengers,[The X-Men],The Justice League, The loss of people from the countryside is known as? ,Rural Loss,[Rural Depopulation],Rural Desertion,What are blood vessels which carry blood to the heart called?,Capillaries,[Veins],Arteries,In 1818 Charles Stuart Parnell was sent to which jail?,[Kilmainham],Mountjoy,Wicklow ,Are you paid a salary if you are paid based on the amount of hours that you work?,[No],Yes,X,"In poetry, a stanza is a repeated pattern of lines with a rhyme scheme. True or False?",[TRUE],FALSE,X
185,Which resident of Jellystone Park is “smarter than the average bear”?,Smokey Bear,[Yogi Bear],Baloo,The movement of people within a country is known as?,Regional Movement,[Regional Migration],Regional Travel,Retinol is commonly know as which vitamin?,Vitamin C,[Vitamin A],Vitamin D,In what year was Charles Stuart Parnell born?,[1846],1855,1836,"What is the average of 6, 4, 7 and 5?",[5.5],5,4.5,"What is the main theme of Brian Friel's play ""Philadelphia here I come""?",[Emigration],Coming of Age,Love
186,How many ounces are there in a pound?,14,[16],12,"The movement of people at certain times of year, for example, fruit harvesters.",Irregular Migration,[Seasonal Migration],Seasonal Travel,Ascorbic acid is commonly known as which vitamin?,Vitamin A,[Vitamin C],Vitamin D,In what year did St Patrick arrive in Ireland?,400 AD,420 AD,[432 AD],"Find the median of this list of numbers: 9, 11, 14, 16, 18, 22, 27",[16],18,14,Gar O' Donnell is the main character in which Brian Friel play?,[Philadelphia Here I Come],Translations,The Freedom of the City
187,Which planet is known as “The Red Planet”?,Jupiter,[Mars],Mercury,What is the return of immigrants to their own country known as?,Deportation,[Repatriation],Extradition,Cholecalciferol is commonly know as which vitamin?,Vitamin C,[Vitamin D],Vitamin E,In 795 Ireland was invaded by which group of people?,Celts,Saxons,[Vikings],What is the number that appears the most amount of times in a list of numbers called?,[The mode],The range,The re-occurrent,Gradgrind and Bounderby are characters in which Charles Dickens novel? ,[Hard Times],Bleak House,Great Expectations
188,From what tree do acorns come?,The Ash,[The Oak],The Chestnut,What is an area which forms an indentation on the coastline known as? ,An Inlet,[A Bay],A Cove,What is the name of the two chromosomes which determine the sex of an organism?,XX Chromosome,[XY Chromosome],MF Chromosome,Brian Boru defeat the Vikings in what battle?,Battle of Tara,Battle of Edington,[Battle of Clontarf],"Find the mean of this group of numbers: 4, 11 and 27",[14],13,27,"Who wrote ""Ulysses""?",[James Joyce],Oscar Wilde,Jonathan Swift
189,What colour are sapphires?,Red,[Blue],Purple,What is an eroded opening through a headland known as? ,Archway ,[Arch],Tunnel,What is the study of animals called?,Animalology,[Zoology],Biology,In what year did Brian Boru defeat the Vikings?,1016,1015,[1014],"When dealing with measures of variability, what does IQR stand for?",[Interquartile range],X,X,The character Shylock In the Merchant of Venice was Jewish. True or False?,[TRUE],FALSE,X
190,Feline means relating to what sort of animal?,Dogs,[Cats],Birds,What is a piece of rock left standing separate from the shoreline called? ,Sea Tower,[Sea Stack],Sea Mountain,If a human had an XY chromosome would they be male or female?,[Male],Female,X,In what year were the Statutes of Kilkenny formed?,1365,1370,[1367],"In complex  numbers, what is 'i' equal to?",[√ - 1],-1,1,Brighton Square in Dublin is the birth place of which Irish writer?,[James Joyce],Seamus Heaney,Roddy Doyle
191,What colour are emeralds?,Blue,[Green],Red,What is the movement of material along the coastline known as?,Coastal Movement,[Longshore Drift],Sea Drift,If a human had an XX chromosome would they be male or female?,[Female],Male,X,Under the reign of which British Monarch did the Laois-Offaly plantation occur?,King Henry VIII,Queen Elizabeth I,[Queen Mary I],True or False? Real numbers are a subset of complex  numbers?,[TRUE],FALSE,X,The Artful dodger is a character from which Charles Dickens Novel?,[Oliver Twist],A Christmas Carol,The Pickwick Papers
192,Which leaves can be used to soothe the pain from stinging nettles?,Oak Leaves,[Dock Leaves],Laurel Leaves,What is the movement of waves up the beach defined as? ,Spray,[Swash],Splash,The pituitary gland is attached to which body organ?,[Brain],Heart,Bladder,"In what century did the ""Flight of the Earls"" occur?",16trh Century,18th Century,[17th Century],What is the name of the diagram on which complex  numbers can be represented?,[The Argand Diagram],Butterfly Diagram,Hasse Diagram,What does PS stand for at the end of a letter?,[Postscript],Post story,Postscore
193,Is an oak a deciduous tree?,No,[Yes],X,What is an area of eroded material deposited on the coastline known as? ,Shoreline,[Beach],Coast,What is the lightest known gas?,[Hydrogen],Oxygen,Helium,In 1649 which British leader invaded Ireland?,King James VI,Sir Walter Raleigh,[Oliver Cromwell],Which part of the equation (a  +  bi)  is called the real part?,[a],b,i,Dracula was the most famous characters of which Irish Writer?,[Bram Stoker],Mary Shelley,Edgar Allen Poe
194,Which chess piece can only move diagonally?,The Knight,[The Bishop],The Queen,What is a concrete wall built along the coastline to protect from sea action called? ,Breaker,[Sea Wall],Ocean Block,Sodium Chloride is the name for which household product?,[Salt],Pepper,Baking Soda,The Penal Code was enacted in what century?,17th Century,19th Century,[18th Century],"In complex  numbers, is √36 √ - 1  = 6i?",[Yes],No,X,"Who wrote the ""Ballad of Reading Gaol""?",[Oscar Wilde],Mark Twain,W B Yeats
195,How many holes are there on a standard golf course?,9,[18],20,What are cities with over 1 million inhabitants known as? ,Epicentres,[Million Cities],Highly Populated Cities,What is the PH of distilled water?,[7],4,6,Wolfe Tone's uprising was crushed in what year?,1790,1801,[1798],"In probability, writing down all possible outcomes is know as what?",[Systematic listing],Finding the rate of probability,Possibility listing ,The poet Robert Burns is of what Nationality?,[Scottish],Irish,English
196,In what stadium do England play their home soccer matches?,Old Trafford,[Wembley],Twickenham,What is an city area where building development needs special permission known as? ,Green Ring,[Green Belt],Green Area,Which gas turns limewater murky?,[Carbon Dioxide],Oxygen,Hydrogen,In what year did the Act of Union cause Ireland to become part of Britain ?,1804,1798,[1801],"If I roll a dice, what are the chances of landing on a prime number?",[3/6 or 1/2],X,X,"""If music be the food of love, play on"" is from which Shakespearean play?",[Twelfth Night],The Tempest,The Two Gentlemen of Verona
197,In what stadium do  Ireland play their home soccer matches?,Croke Park,[Aviva Stadium],Thomond Park,What is an area of undeveloped land within a city known as? ,Green Space,[Green Wedge],Nature Preserve,What effect has acid on litmus?,[It Turns Red],It Turns Green,It Turns Blue,In what year was Daniel O' Connell elected MP?,1828,1830,[1829],"On the probability scale, what does 0.5 mean?",[Even chance],Likely,Impossible,"""The Borstal Boy"" was written by which Irish Author?",[Brendan Behan],Frank McCourt,Elizabeth Bowen
198,In what stadium do France play their home rugby games?,Orange Vélodrome,[Stade de France],Stade Pierre,What is a capital or major city in a country best described as?,Primary City,[Primate City],Prime city,Is codeine a liquid element?,[Yes],No,X,In what year was the Anglo-Irish Treaty signed?,1920,1922,[1921],"In statistics, what are the two types of data that can be collected?",[Categorical and Numerical],X,X,"In Shakespeare Play Macbeth, who kills Macbeth?",[MacDuff],Malcolm,Banquo
199,Which sport takes place in a velodrome?,Skiing,[Cycling],Ice Skating,Where is a rural-urban fringe usually found?,City Centre,[Edge of a City],City Suburbs,What percentage of the air is comprised of oxygen?,[21%],33%,39%,In what year did the provisional IRA begin their campaign to oust the British troops?,1969,1968,[1971],What name is given to categorical data that can be ordered in some way?,[Ordinal data],Numbered data,Ordered data,"From which Shakespearean play is this line: ""Something is rotten in the state of Denmark""",[Hamlet],Twelfth Night,King John
200,What term is used in tennis for the score 40-40?,Ace,[Deuce],Break Point,What can the growth and spread of a city can be described as?,City Growth,[Urban Sprawl],Civic Spread,Which gas is used to fill incandescent light bulbs?,[Argon],Nitrogen,Helium,In what year was the Anglo Irish Agreement signed between Britain and Ireland?,1990,1980,[1985],What are two lines that run alongside each other and never meet called?,[Parallel],X,X,In which Shakespearean play is Antonio the main Character?,Othello,[The Merchant Of Venice],The Two Gentlemen of Verona
201,In which sport might you do a slam dunk?,Netball,[Basketball],American Football,Residential areas towards the edge of the cities are known as? ,[Suburbs],City Fringes,Outskirts,What gas is most common in the Earth's atmosphere?,[Nitrogen],Oxygen,Argon,In what year did the IRA call its first ceasefire?,1992,1993,[1994],What is a flat 2D shape with 10 sides called?,[Decagon],X,X,"Who wrote the novel ""To Kill a Mockingbird""?",Scott Fitzgerald,[Harper Lee],Mark Twain
202,In which sport might you get a free throw?,Volleyball,[Basketball],Netball,"What is a town peripheral to a city, which houses commuter workers, called?",[Dormitory Town],Commuter Town,Worker Town,What percentage of the air is comprised of hydrogen?,[0%],11%,5%,In 1932 who was elected Taoiseach of Ireland?,W T Cosgrave,John A Costello,[Éamon De Valera],"If a line forms a 90° angle with another line, the lines are said to be what to one another?",[Perpendicular],Adjacent ,Parallel,"In the novel ""Animal Farm"" which animals become the leaders of the farm?",The Cows,[The Pigs],The Dogs
203,In which sport might you get an eagle?,Snooker,[Golf],Cricket,What is an area of slum housing often on the edge of a city called?,[A Shanty Town],Hovels,A Slum Town,The rusting of iron is a chemical change. True or false?,[TRUE],FALSE,X,In what year was Pádraig Pearse born?,1882,1885,[1879],Does a trapezium have only 1 set of parallel lines?,[Yes ],No,X,"In the novel ""Animal Farm"" what animal is boxer?",A Bull,[A Horse],A Goat
204,In which sport might you score a maximum break of 147?,Darts,[Snooker],Ice Hockey,What is the capital city of Australia?,[Canberra],Sydney,Melbourne,Is the boiling point of water a chemical change?,[No],Yes,X,What year did Pádraig Pearse join the Gaelic League?,1898,1902,[1896],How many lines of symmetry does a rhombus have?,[2],4,8,Which Patrick Kavanagh novel is about a young poet farmer from Cavan?,The Great Hunger,[Tarry Flynn],The Green Fool
205,In darts what is the maximum score you can achieve by throwing 3 darts?,280,150,[180],What is planting trees on land not previously used for forestry known as?,[Afforestation],Deforestation,Reforestation,What technique is used to separate two liquids?,[Distillation],Titration,Evaporation,In 1908 what was the name of the school opened by Pádraig Pearse? ,St. Thomas's (Scoil Thomás),St  Patrick's (Scoil Phádraig),[St Enda's (Scoil Éanna)],What is the name of the formula used to solve quadratic algebraic equations?,[-b formula],Logarithm, x  formula,Holden Caulfield is a character from which J D Salinger Novel?,Franny and Zooey,[The Catcher in the Rye],Nine Stories
