No,GK,GK1,GK2,GK3,GEO,GEO1,GEO2,GEO3,SCI,SCI1,SCI2,SCI3,HIS,HIS1,HIS2,HIS3,MAT,MAT1,MAT2,MAT3,ENG,ENG,ENG2,ENG3
110,What was the starting scrum half on the team that won the Rugby World Cup in 2019?,[Faf de Klerk],Handrè Pollard,Cheslin Kolbe,Which country owns the Canary Islands? ,Portugal,[Spain],Morocco,What is the green pigment found in plants called?,Eumelanin,[Chlorophyll],Melanin,In 1799 who seized power in France on Christmas Day?,Louis XVI,[Napoleon],Marie Antoinette,"A ""U"" shaped graph is typically know as what type of function?",Linear Function ,[Quadratic function],Exponential Function,"The Dukes of Burgundy, Cornwall and Albany are all characters from which Shakespearean play?",Othello,[King Lear],Richard III
111,Which American golfer won The Masters Tournament in 2019?,[Tiger Woods],Dustin Johnson,Rickie Fowler,What river flows into the Boyne at Navan? ,The Moy,[The Blackwater],The Barrow,The cornea is found in which body part?,Nose,[Eye],Ear,In 1793 which King of France was executed?,Louis XV,[Louis XVI],Louis XIV,A sequence of numbers with the same difference between each one and the next is what type of pattern?,Exponential Pattern,[Linear pattern],Squared Pattern,"From which Shakespearean play is this line: ""It is a wise father that knows his own child""",Romeo & Juliet,[Merchant of Venice],The Winter's tale
112,Name the team that won the English Premier League in 2016/2017 season?,[Chelsea],West Ham,Tottenham Hotspurs,On what river does Cork stand? ,River Blackwater,[River Lee],River Nore,Genes are held in which structure of the nucleus?,Nuclear membrane,[Chromosome],Endosomes,In which century did the Industrial revolution begin?,19th Century,[18th Century],17th Century,"On a graph, the  X axis is the vertical axis. True or False?",TRUE,[FALSE],X,"From which Shakespearean play is this line: ""For a light wife doth make a heavy husband""",Henry V,[Merchant of Venice],Romeo & Juliet
113,Name the team that won the English Premier League in 2015/2016 season?,[Leicester City],Manchester City,Arsenal,In what Irish county is Boyle? ,Clare,[Roscommon],Meath,What is the protection and management of natural resources called?,Exploitation,[Conservation],Reservation,In 1532 the Inca Empire was conquered by which Spanish explorer?,Vasco Nuñez de Balboa ,[Francisco Pizzaro],Hérnan Cortés,The minus B formula is used in algebra to solve quadratic equations. True or False?,FALSE,[TRUE],X,"From which Shakespearean play is this line: ""Let me not play a woman I have a beard coming""",Othello,[A Midsummer Nights Dream],King Lear
114,Name the team that won the English Premier League in 2014/2015 season?,Tottenham Hotspurs,[Chelsea],Manchester United,In what Irish county is Borris? ,Kilkenny,[Carlow],Wicklow,What are trees which shed their leaves called?,Evergreen Trees,[Deciduous Trees],X,Who was the first man to circumnavigate the world?,Christopher Columbus ,[Ferdinand Magellan],Juan Ponce de León ,Solve 2(6 x )  +  3( - 2 x )  +  8 x y,12x   +  8xy,[6x   +  8xy],4x   +  5  + 8xy,"From which Shakespearean play is this line: ""Everyone can master a grief but he that has it""",Hamlet,[Much Ado About Nothing],The Merry Wives of Windsor
115,Name the team that won the English Premier League in 2013/2014 season?,Manchester United,[Manchester City],Chelsea,In what Irish county is Rosslare? ,Waterford,[Wexford],Cork,What are organisms which feed on dead animals and plants called?,Degraders,Decayers,[Decomposers],In 400BC which tribes invaded Ireland?,The Vikings,[The Celts],The Scots,"In algebra, is  x  squared  =  x   +   x ? True or False?",TRUE,[FALSE],X,"From which Shakespearean play is this line: ""Good gentle youth, tempt not a desperate man""",Othello,[Romeo & Juliet],The Merchant of Venice
116,To which club did Cristiano Ronaldo transfer after his time at Manchester United?,Juventus ,[Real Madrid],FC Barcelona,In what Irish county is Naas? ,Wicklow,[Kildare],Dublin ,Insulin is produced in which body part?,Kidneys,Liver,[Pancreas],In 432AD St Patrick brought what to Ireland?,[Christianity],X,X,Solve 3b  +  4a  +  6ab  + 7b,[10b  +  4a  +  6ab],X,X,"From which Shakespearean play is this line: ""As fire drives out fire, so pity pity""",Richard III,[Julius Caesar],King John
117,Name the captain of the English football team for the World Cup in 2018?,Kieran Trippier,[Harry Kane],Eric Dier,In what Irish county is Tullamore? ,Longford,[Offaly],Laois,What illness does the lack of the substance insulin cause?,Pancreas Disease,Pancreatitis,[Diabetes],"In the 12th Century, what group of people invaded Ireland?",Saxons,Vikings,[Normans],"Solve 4 x   +   x -3, when  x   =  - 2",[-13],-11,3,"From which Shakespearean play is this line: ""Fair is foul and foul is fair, hover through the fog and filthy air""",Hamlet,[Macbeth],The Tempest
118,Which female tennis player won back-to-back titles at Wimbledon in 2015 and 2016?,Venus Williams,[Serena Williams],Maria Sharapova,In what Irish county is Mullingar? ,Meath,[Westmeath],Louth,What is the process by which food is made soluble called?,Ingestion,Consumption,[Digestion],Where did the Vikings originate from?,Iceland,Central Europe,[Scandinavia],Find the value of  x  in this equation: 4 x   +  2 = 18,[4],3.5,5,"From which Shakespearean play is this line: ""Receive what cheer you may. The night is long that never finds the day""",Othello,[Macbeth],The Merchant of Venice
119,Which team won the NBA Championship in 2016?,Golden State Warriors,[Cleveland Cavaliers],Toronto Raptors,In what Irish county is Roscrea?,Offaly,[Tipperary],Roscommon,What is Deoxyribonucleic acid commonly known as?,DLT,DBB,[DNA],The Battle of the Boyne took place in what year?,1790,1691,[1690],"What is the sum of all the angles in any triangle, in degrees?",[180°],360°,270°,"From which Shakespearean play is this line: ""To be or not to be that is the question""",Macbeth,[Hamlet],Romeo & Juliet
120,What country did Alan Shearer play soccer for?,Ireland,[England],France,In what Irish county is Cobh?,[Cork],Kerry ,Clare,"What is the study of the relationship of plants, animals and the environment is known as?",Habitatology,Biology,[Ecology],How many wives did the English King Henry VIII have?,5,8,[6],"What is the value, in degrees, of a right angle?",[90°],180°,45°,Which Shakespearean play involves a lottery of caskets to win Portia's hand in marriage?,Othello,[The Merchant of Venice],King Lear
121,What country did Gareth Southgate manage at the FIFA World Cup in 2018?,Germany,[England],Croatia,In what Irish county is Killarney?,[Kerry],Cork,Limerick,What is the process of  groups of animals and plants interacting together in an area called?,Macrosystem,Microsystem,[Ecosystem],What Church was started by King Henry VIII?,Protestant Church,Presbyterian Church,[Church of England],How many degrees is there in a regular parallelogram?,[360°],180°, 240°,"From which Shakespearean play is this line: ""Pleasure and action make the hours seem short""",Romeo & Juliet,[Othello],The Winter's Tale
122,What country does soccer player Kylian Mbappé play for?,Italy,[France],Germany,In what Irish county is Lahinch?,[Clare],Cork,Kerry,"What is the oviduct, which carries the egg from the ovary to the uterus, called?",Uterine Cavity,Fallopian Canal,[Fallopian Tube],Ireland became part of the United Kingdom of Britain and Ireland in what year?,1805,1800,[1801],Up to how many degrees is an acute angle?,[Smaller than 90°],Larger than 90°,Smaller than 180°,"From which Shakespearean play is this line: ""Mend your speech a little, lest it may mar your fortunes""",Henry V,[King Lear],Julius Caesar
123,Which rugby club won the Champions Cup in 2019?,Leinster,[Saracens],Munster,In what Irish county is Athlone?,[Westmeath],Longford,Meath,What noun is used to describe all the animals of an ecosystem?,Animalia,Mammals,[Fauna],The potato famine in Ireland began in what year?,1842,1840,[1845],289 -77 + 49 + 138 =,[399],419,359,"What word is used to describe people, places, animals and things?",An Adjective,[A Noun],A Preposition
124,Which team won the men's Rugby world cup in 2003?,New Zealand ,[England],Australia,In what Irish county is Skibbereen?,[Cork],Kerry ,Clare,What noun used to describe all the plants of an ecosystem?,Greenery,Foliage,[Flora],The War of Independence in Ireland ended in what year?,1919,1920,[1921],68 + 159 - 36 =,[191],221,189,A proper noun is a type of noun used to describe what?,Places,[People],Objects
125,Which team won the men's Rugby World Cup in 2007?,Australia,[South Africa],England,In what sea does Malta lie? ,[Mediterranean Sea],Dead Sea,Adriatic Sea,By what name is the femur bone more commonly known?,Arm,Leg,[Thigh],In 1937 what was the Irish free state renamed as?,Éireann,[Éire],Irish Republic ,What is the formula  to find the area of a parallelogram?,[Base  x   perpendicular height],X,X,"I', 'me', 'you', 'he' and 'she' are known as what types of pronouns?",Reciprocal Pronouns,[Personal Pronouns],Demonstrative Pronouns
126,What sport does Tiger Woods play?,Cricket,[Golf],Soccer,Name the three sister rivers in Ireland?,"[The Nore, Suir and Barrow]",X,X,What is the symbol for calcium?,Cu,C,[Ca],In 1920 the Government of Ireland Act provided what?,Independence,[Partition],An independent Irish parliament,What type of triangle has sides of three different lengths?,[Scalene triangle],Equilateral triangle,Isosceles triangle,"Mine', 'yours', 'his', 'hers' and 'theirs' are known as what type of pronouns?",Reflexive Pronouns,[Possessive Pronouns],Relative Pronouns
127,Name the team that won the UEFA Champions League final  in the 2015/2016 season?,Barcelona,[Real Madrid],Inter Milan,What is the largest island in Greece? ,[Crete],Corfu,Zakynthos,What is the symbol for zinc?,Zi,Z,[Zn],In what year did the Civil War in Ireland take place?,1922,[1921],1920,How many lines of symmetry does an equilateral triangle have?,[3],2,1,"Who', 'whose', 'which', 'what' are known as what type of pronouns?",Indefinite Pronouns,[Relative Pronouns],Interrogative Pronouns
128,Name the team that won the UEFA Champions League final  in the 2014/2015 season?,Juventus ,[Barcelona],Bayern Munich ,What countries are in the Iberian Peninsula?,[Spain and Portugal],Norway and Sweden,Greece and Albania,What is the unit of heredity called?,Genetic ,Chromosome,[Gene ],Dáil Eireann declared independence from Britain in what year?,1916,[1919],1918,What is a specific slice of a circle known as?,[Sector],Piece,Segment,Pronouns take the place of what in a sentence?,Adverbs,[Nouns],Conjunctions
129,Who was the CEO of Amazon in 2019?,Warren Buffett,[Jeff Bezos],Bill Gates,What is the centre of a hurricane called? ,[The Eye],The Centre,The Spiral,What are animals which eat plants only called?,Omnivores,Carnivores,[Herbivores],The Ulster Volunteers formed in what year?,1912,[1913],1914,What is the name of the line that runs from the centre of a circle to its circumference?,[Radius],Diameter,Chord,"'Myself', 'yourself' and 'ourselves' are what type of pronouns?",[Reflexive pronouns],Possessive Pronouns,Reciprocal Pronouns
130,"Who is the CEO of Vitabiotics and one of the investors on ""Dragons' Den""?",Peter Jones,[Tej Lalvani],Jeff Bezos,In which country is the Algarve? ,[Portugal],Spain,Morocco,What are animals that eat both plants and animals called?,Carnivores,Herbivores,[Omnivores],The Gaelic League spread throughout Ireland in what year?,1902,[1903],1905,"If the length of a circle's diameter is 14.6 cm, what is it's radius?",[7.3cm],X,X,"Each', 'everybody', everyone' and 'everything' are what type of pronouns?",[Distributive pronouns],Personal Pronouns,Relative Pronouns
131,Name the team that won the UEFA Champions League final in 2017/2018 season.,Liverpool,[Real Madrid],Paris Saint Germain,"Name the largest of the four provinces in Ireland, in terms of size?",[Munster],Leinster,Ulster,What is the process of passing traits from parent to children through genes called?,Genetics,Inheritance,[Heredity],Home Rule was a movement to gain what for Ireland?,An Irish judiciary,[An Irish Parliament],An Irish republic,What fraction can Pi be represented as?,21-Jul,[22/7],20-Jul,Actions and states are expressed by what type of words?,[Verbs],Adverbs,Adjectives
132,Who scored an overhead-kick goal in the UEFA Champions League final in 2018?,Cristiano Ronaldo,[Gareth Bale],Marco Asensio,Off which county’s coast lie the Blasket Islands?,[Kerry],Cork,Clare,What is the name of the major organs of excretion in animals?,Pancreas,Liver,[Kidneys],Who founded the Irish Parliamentary Party?,Charles Stewart Parnell ,[Isaac Butt],Hugh Law,How many corners does a cuboid have?,12,[8],4,What part of speech are the words 'because' and 'although'?,[Conjunctions],Prepositions,Interjections
133,For which country did Dan Carter play rugby?,Australia,[New Zealand],France,Off which county’s coast lie the Saltee Islands?,[Wexford],Donegal,Galway,"Dogs, Whales and Humans are classed as what types of animals?",Herbivores,Carnivores,[Mammals],How many Home Rule bills were introduced before they were passed?,5,[4],2,How many edges does a cube have?,16,[12],24,'To be' and 'to have' are known as what types of verbs?,[Auxiliary verbs],Modal verbs,Action verbs
134,For which country did Shane Williams play rugby?,Ireland,[Wales],Scotland,Off which county’s coast lie the Aran Islands? ,[Galway],Mayo,Cork,What is the process whereby an animal evolves from egg to adult in four distinct stages called?,Peristalsis,Development,[Metamorphosis],Where did John Redmond give his famous speech urging Irishmen to join the British Army?,O'Connell Bridge,[Woodenbridge],Liberty Hall, 12 x 12  + 36,166,[180],186,What words are used to give us more  information about nouns?,[Adjectives],Pronouns,Prepositions
135,For which country did Paul O'Connell play rugby?,England,[Ireland],Wales,What is the capital of New Zealand? ,[Wellington],Auckland,Christchurch,"What is the study of bacteria, fungi and viruses know as?",Bacteriology,Micro bacteriology,[Microbiology],The Land League was formed in which year?,1880,[1879],1878,How many laws of indices are there?,7,[9],8,What words are used to tell us more about verbs?,[Adverbs],Adjectives,Interjections
136,For which country did Jonny Wilkinson play rugby?,New Zealand,[England],Wales,On what river is London situated?  ,[The Thames],The Hudson,The Danube,What is Myopia more commonly known as?,Sneezing,Pins & Needles,[Short Sightedness],Eoin McNeill founded what organisation?,Ulster Volunteers ,[Irish Volunteers],The Irish Republican Brotherhood,"In maths, another name for indices is?",Roots,[Powers],Factorials,Is the word 'radar' a palindrome?,[Yes],No,X
137,For which country did Gregor Townsend play rugby?,Wales,[Scotland],Ireland,In what English county is Land’s End? ,[Cornwall],Norfolk,Kent,What is a nerve cell called?,Motor neuron,Node,[Neuron],Where was Éamon De Valera born?,Ireland,[America],England,What is the name of the set of numbers that represents only whole positive and negative numbers?,Rational Numbers,[Integers],Real Numbers,Words which are used to join sentences are known as what?,[Conjunctions],Interjections,Prepositions
138,For which country did Brian O'Driscoll play rugby?,Wales,[Ireland],England,What is the highest mountain in the Alps?,[Mount Blanc],Dolomites,Grossglockner,What is the swollen area where a leaf joins the stem of a plant known as?,Bud,Stalk,[Node],The Irish Republican Brotherhood (IRB) was founded in what year?,1860,[1858],1910,Is 5 a natural number?,No,[Yes ],X,"""But"" and ""and"" are known as what type of words?",[Conjunctions],Prepositions,Interjections
139,For which country did Martin Johnson play rugby?,Ireland,[England],Wales,Name the Benelux countries?,"[Belgium, Netherlands and Luxembourg]",X,X,What is the part of the alimentary canal between the mouth and the stomach called?,Throat,Trachea,[Oesophagus],The Catholic Emancipation Act was passed in which year?,1830,[1829],1832,"If a number can be written as a/b, where a and b are whole numbers, what type of number is it?",Irrational Number,[Rational Number],Real Numbers," 'Below','above' and 'after' are examples of prepositions. True or false?",[TRUE],FALSE,X
140,For which country did Richie McCaw play rugby?,Wales,Ireland,[New Zealand],What is the tallest mountain in Ireland?,Lugnaquilla,Brandon Mountain,[Carrauntoohil],What are carbon compounds derived from living things called?,Eco Compounds,Natural Compounds,[Organic Compounds],How many British soldiers were involved in the Battle of Vinegar Hill in 1798?,"10,500","[13,000]","12,000",The set of integers are represented by what letter?,I,[Z],Q,What punctuation is used to mark the end of a sentence?,[Full Stop],Comma,Semicolon
141,For which country did Ronan O'Gara play rugby?,Wales,Scotland,[Ireland],What is Ireland’s largest inland county? ,Limerick,Tyrone,[Tipperary],By what name is the process of releasing an egg from the ovary known?,Ejaculation,Menstrual Cycle,[Ovulation],Who led the 1798 rebellion of United Irishmen?,Henry Joy McCraken,[Wolfe Tone],Lord Edward Fitzgerald,Is √2 an irrational number?,No,[Yes ],X,A sentence always begins with a capital letter. True or False?,[TRUE],FALSE,X
142,For which country did Neil Jenkins play rugby?,Scotland,England,[Wales],In what Irish county are the Maumturk Mountains?,Wicklow,Cork,[Galway],By what name is the study of fossils more commonly known?,Fossilology,Archaeology,[Palaeontology],In 1607 which British monarch oversaw the plantation of Ulster?,Queen Mary I,[King James I],Queen Elizabeth I,What is the LCM (Lowest Common Multiple) of 6 and 8?,12,[24],48,Days of the weeks and months of the year always begin with a capital letter. True or False?,[TRUE],FALSE,X
143,Which sport does Ronnie O'Sullivan play?,Rugby,Soccer,[Snooker],"Roundwood, Ireland’s highest village, is in which county?",Kerry,Dublin,[Wicklow],What is an organism which lives in or on another organism called?,Bacteria,Fungus,[Parasite],The Battle of Jutland in the first World War was between which two naval fleets?,French & German,[British & German],USA & German,Natural numbers that aren't prime and that are greater than 1 are called what?,Rational Numbers,[Composite numbers],Natural Numbers,What punctuation mark is used for all direct questions?,[Question Mark (?)],Exclamation Mark (!),"Quotation marks ("""")"
144,"Which sport did Phil ""The Power"" Taylor play?",Snooker,Tennis,[Darts],In what county is Lough Conn?,Galway,Longford,[Mayo],The patella is commonly known as what part of the leg?,Hip,Ankle,[Knee Cap],In what year did the Boer War in South African War break out?,1898,[1899],1902,1 is a prime number. True or False?,TRUE,[FALSE],X,What punctuation mark is used to link two independent clauses that are closely related in thought?,[Semicolon],Colon,Comma
145,Which sport does Tommy Fleetwood play?,Cricket,Soccer,[Golf],The Blackstairs Mountains straddle which two counties? ,Carlow and Kilkenny,Wexford and Wicklow,[Carlow and Wexford],By what name is a plant which survives for more than two years known?,Perpetual,Long Life,[Perennial],In what year during the World War II did the Allies enter Germany?,1945,[1944],1943,Is there an even prime number?,No,"[Yes, the number 2 ]",X,What punctuation mark is used to make a sentence more clear?,[Comma],Semicolon,Full Stop 
146,Who beat Anthony Joshua in his first pro defeat in 2019?,Deontay Wilder,Tyson Fury,[Andy Ruiz Jr.],In what county is the Ards Peninsula?,Antrim,Derry,[Down],The Acidity or Alkalinity of an entity are measured on what scale?,[PH Scale],X,X,Who was the fascist dictator of Italy between 1922-1943?,Giolitti ,[Mussolini],Luzzatti,What is the HCF (Highest Common Factor) of 60 and 84?,6,[12],4,"Which Irish novelist wrote ""The Snapper"" and ""The Commitments""?",[Roddy Doyle],Colm Tóibín,Sebastian Barry
147,In which sport does Chris Froome compete?,Triathlon,Swimming,[Cycling],In what county are the Cliffs of Moher? ,Kerry,Cork, [Clare],On the PH Scale what does PH stand for?,Power of Helium,[Power of Hydrogen],Plus Hydrogen,What year did Italy and Germany sign the Pact of Steel?,1938,[1939],1936,Are the processes of addition and multiplication commutative operations?,No,[Yes ],X,What punctuation mark is used with a noun to indicate possession?,[Apostrophe],X,X
148,In which sport does Mo Farah compete?,Skiing,Swimming,[Athletics],In what county is the Cooley Peninsula? ,Meath,Sligo,[Louth],Chlorophyll and light are necessary for which process that occurs in plants?,Growth and development,[Photosynthesis],Seeding and fruit dispersal,Which European country was engaged in civil war between 1936-1939?,Portugal,[Spain],Argentina,Is subtraction an associative operation?,Yes,[No],X,How many punctuation marks are there in English grammar?,[14],10,8
149,In which sport does Lewis Hamilton compete?,Athletics,Cycling,[Formula One],In what county is the Bog of Allen? ,Mayo,Wicklow,[Kildare],What powder is produced by the anthers of seed bearing plants?,Ragweed,[Pollen],Antigen,In 1921 who became chairman of the Nazi party?,Himmler,[Hitler],Von Alvensleben ,What letter represents the set of rational numbers?,R,[Q],X,"What punctuation mark is used to introduce a quotation, a list or express a strong contrast?",[Colon],Semicolon,Dash
150,In which sport does Anthony Joshua compete?,Rowing,Cycling,[Boxing],In what county are the Blue Stack Mountains? ,Cavan,Mayo,[Donegal],By what name are microscopic plants floating in water known?,Seaweed,[Plankton],Alga,"Where was leader of the Soviet Union, Joseph Stalin, born in 1878?",Russia,[Georgia],Czechoslovakia,What is 4(2)  -  2(3)  -  ( + 4) ?,14,[-2],6,What punctuation mark shows a longer pause than a comma but not as long as a full stop?,[Semicolon],Ellipsis,Colon
151,In which sport does Conor McGregor compete?,Karate,Boxing,[MMA (UFC)],In what county is the Vale of Avoca? ,Limerick,Wexford, [Wicklow],What is an animal which kills and eats other animals called ?,Top-tier animal,[Predator],Mammal,In which decade was the Vatican City declared an independent state from Italy?,1910s,[1920s],1890s,5(2)  +  2(-7)  +  8  =,[4],13,-7,Estragon and Vladimir are two of the main characters in which Samuel Beckett play?,[Waiting for Godot],Happy Days,Breath
152,Name the 44th President of United States of America?,Hillary Clinton,Donald J. Trump,[Barack Obama],Off what county is Tory Island? ,Mayo,Derry,[Donegal],What are plants which make their own food by photosynthesis called?,Creators,[Producers],Providers,"In 1924, what leader of the Soviet Union died?",Khrushchev,[Lenin],Malenkov,(16  x 9)  -11  =,[133],101,42,Waiting for Godot is a play that deals with the ambiguity of existence. True or false?,[TRUE],FALSE,X
153,Name the 45th President of United States of America?,George W Bush,Barack Obama,[Donald J. Trump],What is the second smallest county in Ireland?,Dublin,Armagh,[Carlow],By what name is an organism in which a parasite lives and reproduces known?,Secondary Host,[Primary Host],Life Host,"When Germany invaded the USSR in 1942, what  defensive policy did Stalin implement?",Burnt Land ,[Scorched Earth],Damaged Structure,(2 x -8)  -  ( + 15)  =,[-31],1,-1,"In the play ""Waiting for Godot"" does Godot ever turn up?",[No],Yes,X
154,Name the 43rd President of United States of America?,Richard Nixon,Bill Clinton,[George W Bush],In what county is the highest waterfall in Ireland located?  ,Limerick,Cork,[Wicklow],What is the gland which surrounds the urethra at the neck of the bladder called?,Gastric Gland,[Prostate Gland],Tubular Gland,In 1932 who became leader of the Irish Free State?,Arthur Griffith ,[Éamon De Valera],W.T Cosgrave,2(3 x -5)  +  4  =,[-26],34,-22,Piggy is the main character in which William Golding Novel?,The Spire,The Inheritors,[Lord of the Flies]
155,Name the 42nd President of United States of America?,George W Bush,George H W Bush,[Bill Clinton],In what county is the limestone region the Burren?,Kerry,Cork,[Clare],What is the nutrient that is made of amino acids called?,Fat,[Protein],Carbohydrates,In which year did Éamon De Valera die?,1976,[1975],1978,Is a  x  b  x  c  = b  x  c  x  a ?,[Yes],No,X,In what poem does Wordsworth compare nature to his life as a boy and then as a man?,I Wandered Lonely as a Cloud,My Heart Leaps Up,[Tintern Abbey]
156,In 2018 who was the Prime Minister of  the United Kingdom?,Donald J. Trump,Jeremy Corbyn,[Teresa May],Rathlin Island lies off the coast of what Ulster County? ,Donegal,Derry,[Antrim],What is the hole in the iris through which light passes into the eye called?,Aorta,[Pupil],Carnivores,In 1933 who was elected chancellor of Germany declaring the Third Reich?,Paul von Hindenburg,[Adolf Hitler],Ludwig Erhard,Is (a  +  b)  +  c  = a  +  (b  +  c) ?,[Yes],No,X,Nationalism and heroism are themes from which Sean O' Casey play?,The Shadow of a Gunman,Juno and the Paycock,[The Plough and the Stars]
157,Who was the Taoiseach of the Republic of Ireland in 2018?,Barry Cowen,Micheál Martin,[Leo Varadkar],What is the second longest river in Ireland? ,The Slaney,The Liffey,[The Barrow],What disease is caused by a lack of vitamin C?,Night Blindness,[Scurvy],Osteoporosis,"In Germany, The Night of the Long Knives occurred in which decade?",1920's,[1930's],1940's,Is (a  -  b)  +  c  = (b  -  a)  +  c ?,[No],Yes,X,"""Death of a Salesman"" is a play by which American playwright?",Edward Albee,August Wilson,[Arthur Miller]
158,Who was the Taoiseach of the Republic of Ireland in 2016?,Brian Cowen,Micheál Martin,[Enda Kenny],The Giant's Causeway is formed from what type of rock? ,Granite,Limestone,[Basalt],What is the Nucleic acid found in the nucleus and cytoplasm of cells called?,DNA,[RNA],RA,What does the German word 'Führer' mean?,Chief,[Leader],Controller,How many millimetres are in 1.53 metres?,"15,300mm",153mm,"[1,530mm]",Willy Loman is the main character in which Arthur Miller play?,After the Fall,All my Sons,[Death of a Salesman]
